{
  "$schema": "http://json-schema.org/draft-07/schema#",
  "title": "Lab Defaults",
  "description": "Smart defaults for the lab lifecycle wizard. Place as lab-defaults.json in hackcontent/<slug>/lab/. Only include fields you want to override — missing fields are ignored.",
  "type": "object",
  "properties": {
    "$schema": {
      "type": "string",
      "format": "uri",
      "description": "Optional URI of the lab-defaults JSON schema."
    },
    "groups": {
      "type": "array",
      "items": { "type": "string" },
      "description": "Group-based feature activation names (e.g. [\"GHCPUsers\", \"M365-E5-Users\"]). Each group provisions a feature for the created Entra ID users."
    },
    "deploymentType": {
      "type": "string",
      "enum": ["resourcegroup", "subscription", "resourcegroup-with-subscriptionowner"],
      "description": "Azure deployment scope."
    },
    "labsPerSubscription": {
      "type": "integer",
      "minimum": 1,
      "maximum": 100,
      "description": "Number of lab environments to pack per Azure subscription."
    },
    "preferredLocation": {
      "type": "string",
      "description": "Comma-separated list of preferred Azure regions, in priority order (e.g. \"swedencentral, norwayeast\")."
    },
    "estimatedDailyCostsUsd": {
      "type": "number",
      "minimum": 0,
      "description": "Estimated daily cost per lab environment in USD: the running cost of the resources deploy-lab.ps1 creates. Used for cost forecasting in the lab lifecycle wizard. Defaults to 25 when absent or < 1."
    },
    "estimatedGlobalDeploymentDailyCostsUsd": {
      "type": "number",
      "minimum": 0,
      "description": "Estimated daily cost in USD of resources created once per event by global-event-deploy.ps1, not multiplied by subscription count. The Console only runs this hook when its parameter contract matches and this value is greater than 5; re-import the content pack after enabling it."
    },
    "estimatedSharedDeploymentDailyCostsUsd": {
      "type": "number",
      "minimum": 0,
      "description": "Estimated daily cost in USD of the resources shared-deploy-lab.ps1 creates. That hook runs once per Azure subscription, so this is multiplied by the subscription count: labs / labsPerSubscription (rounded up) for deploymentType resourcegroup and resourcegroup-with-subscriptionowner, or one per lab for deploymentType subscription. Defaults to 0 when absent or negative."
    }
  },
  "additionalProperties": false
}
