{
  "$schema": "https://raw.githubusercontent.com/microsoft/MicroHack/refs/heads/main/lab-defaults-schema.json",
  "groups": ["M365-E5-Users"],
  "deploymentType": "resourcegroup",
  "labsPerSubscription": 5,
  "preferredLocation": "swedencentral, westeurope, norwayeast",
  "estimatedDailyCostsUsd": 18.0
}
