{
  "$schema": "https://raw.githubusercontent.com/microsoft/MicroHack/refs/heads/main/lab-defaults-schema.json",
  "groups": [],
  "deploymentType": "resourcegroup-with-subscriptionowner",
  "labsPerSubscription": 4,
  "preferredLocation": "swedencentral, westus3, westeurope",
  "estimatedDailyCostsUsd": 22.0,
  "estimatedSharedDeploymentDailyCostsUsd": 0.0
}
