{
  "$schema": "https://raw.githubusercontent.com/microsoft/MicroHack/refs/heads/main/lab-defaults-schema.json",
  "groups": ["GHCPUsers"],
  "deploymentType": "resourcegroup",
  "labsPerSubscription": 4,
  "preferredLocation": "swedencentral, germanywestcentral",
  "estimatedDailyCostsUsd": 11,
  "estimatedSharedDeploymentDailyCostsUsd": 0
}
