{
  "$schema": "https://raw.githubusercontent.com/microsoft/MicroHack/refs/heads/main/lab-defaults-schema.json",
  "groups": [],
  "deploymentType": "resourcegroup",
  "labsPerSubscription": 2,
  "preferredLocation": "spaincentral, swedencentral",
  "estimatedDailyCostsUsd": 45.0,
  "estimatedSharedDeploymentDailyCostsUsd": 110.0
}
