{
  "$schema": "https://raw.githubusercontent.com/microsoft/MicroHack/refs/heads/main/lab-defaults-schema.json",
  "groups": ["GHCPUsers"],
  "deploymentType": "resourcegroup-with-subscriptionowner",
  "labsPerSubscription": 5,
  "preferredLocation": "swedencentral, germanywestcentral, francecentral",
  "estimatedDailyCostsUsd": 5.0,
  "estimatedSharedDeploymentDailyCostsUsd": 0.0
}