{
  "$schema": "https://raw.githubusercontent.com/microsoft/MicroHack/refs/heads/main/lab-defaults-schema.json",
  "groups": [ "" ],
  "deploymentType": "resourcegroup",
  "labsPerSubscription": 4,
  "preferredLocation": "swedencentral, norwayeast, spaincentral",
  "estimatedDailyCostsUsd": 25.0,
  "estimatedSharedDeploymentDailyCostsUsd": 0.0
}
