{
  "$schema": "https://raw.githubusercontent.com/microsoft/MicroHack/refs/heads/main/lab-defaults-schema.json",
  "groups": ["GHCPUsers"],
  "deploymentType": "resourcegroup-with-subscriptionowner",
  "labsPerSubscription": 5,
  "preferredLocation": "francecentral, germanywestcentral, eastus2, swedencentral",
  "estimatedDailyCostsUsd": 8.0,
  "estimatedSharedDeploymentDailyCostsUsd": 0.0
}
